{
  "$schema": "http://json-schema.org/draft-07/schema#",
  "title": "ContentSmithProductCatalog",
  "description": "Schema for structured vendor product catalog extracted from video recordings (WhatsApp chat recordings, walkthroughs, or shelf displays).",
  "type": "object",
  "required": ["products"],
  "properties": {
    "vendor_name": {
      "type": ["string", "null"],
      "description": "Name of the vendor, business, or shop if identified from audio or visual cues."
    },
    "vendor_phone": {
      "type": ["string", "null"],
      "description": "WhatsApp or phone number of the vendor if shown on screen (e.g., chat header, banner, watermark) or spoken."
    },
    "currency_default": {
      "type": ["string", "null"],
      "description": "Primary currency detected (e.g., NGN, USD, GBP, EUR, KES, GHS)."
    },
    "products": {
      "type": "array",
      "description": "List of distinct products identified in the video.",
      "items": {
        "type": "object",
        "required": ["id", "name", "price", "description", "best_timestamp_sec", "confidence"],
        "properties": {
          "id": {
            "type": "string",
            "description": "Unique identifier for the product (e.g. p1, p2, p3)."
          },
          "name": {
            "type": "string",
            "description": "Concise, descriptive product title (e.g., 'Embroidered Kaftan Set', 'Leather Crossbody Bag')."
          },
          "price": {
            "type": ["object", "null"],
            "description": "Price details. MUST BE NULL if no price is shown or spoken. NEVER guess or invent a price.",
            "properties": {
              "amount": {
                "type": ["number", "null"],
                "description": "Numerical price value without commas or currency symbols (e.g. 15000)."
              },
              "currency": {
                "type": ["string", "null"],
                "description": "ISO currency code or standard abbreviation (e.g. NGN, USD, GBP, KES)."
              },
              "source": {
                "type": "string",
                "enum": ["on_screen", "price_tag", "spoken", "none"],
                "description": "Where the price was detected: on_screen (chat message, text overlay), price_tag (physical tag or sticker), spoken (vendor narration), or none."
              }
            },
            "required": ["amount", "currency", "source"]
          },
          "description": {
            "type": "string",
            "description": "Short description covering material, color, size, available variants, or condition mentioned in audio or visuals."
          },
          "category": {
            "type": ["string", "null"],
            "description": "Optional broad product category (e.g., Clothing, Bags, Footwear, Accessories, Electronics)."
          },
          "best_timestamp_sec": {
            "type": "number",
            "description": "Timestamp in seconds (can be float, e.g. 14.5) where the item is most clearly visible, stationary, and unobstructed for frame capture."
          },
          "confidence": {
            "type": "number",
            "minimum": 0.0,
            "maximum": 1.0,
            "description": "Confidence score from 0.0 to 1.0 assessing visibility, identification accuracy, and pricing certainty."
          }
        }
      }
    }
  }
}
